Pid,is_helpful,rating,Actual Response,Review Number,Cost per review,Time Taken,amazon_page,Review text,Rephrased Snippets,aspect,QA_Content,Accept,Processed_QA_Content,id,accept_choice1,accept1,annotator,annotation_id,created_at,updated_at,lead_time,Model_choice,compare
0293a9d2-8cbb-11ed-a7ba-930ee103a0a2,10,5,"{""feature"":""capacity of project-folders"", ""actual_sentence_extracted"":""It is 9 by 11.5, perfect fit for paper size Letter that we use in U.S."", ""rephrased_it(without experience & observation)"":""The user mentioned that the tablet is a perfect fit for paper size Letter that they use in U.S."", ""sentiment"":""positive""}",5,0,1.971558570861816,https://amazon.com/dp/B07T87W72Q,"I bought another brand claiming it was for paper size Letter.

But 8.5 (too short) by 12 (too long) is really for paper size A4.

I returned it and found this item.

It is 9 by 11.5, perfect fit for paper size Letter that we use in U.S. Also, the quality is significantly better than the other brand in thickness and edge finish.

Height recommended.","{'feature': 'capacity of project-folders', 'actual_sentence_extracted': 'It is 9 by 11.5, perfect fit for paper size Letter that we use in U.S.', 'rephrased_it(without experience & observation)': 'The user mentioned that the tablet is a perfect fit for paper size Letter that they use in U.S.', 'sentiment': 'positive'}",capacity,The user mentioned that the tablet is a perfect fit for paper size Letter that they use in U.S.,,The tablet is a perfect fit for the paper size Letter that I use in the U.S.,490577,NO,The tablet is a perfect fit for the paper size Letter that I use in the U.S.,30,400654,2024-06-05T09:40:14.441031Z,2024-06-05T09:40:14.441082Z,11.823,NO,same
0293a9d2-8cbb-11ed-a7ba-930ee103a0a2,4,5,"""{'feature': 'capacity of project-folders', 'actual_sentence_extracted': 'I think this might be able to hold around 15-20 sheets.', 'rephrased_it(without experience & observation)': 'The user mentioned that the sleeve can hold around 15-20 sheets.', 'sentiment': 'positive'}""",1,0,1.732728958129883,https://amazon.com/dp/B07T87W72Q,"Sturdy and just right for american letter size.  

See pic -- there are 2 sheets inside, one is a page pulled out of a magazine (since I often cut out interesting articles and collate them) and behind it (the neon green) is a colored US letter size sheet.  

The sleeve itself holds up and stands up nicely without falling down (not the filmy-type).  

I think this might be able to hold around 15-20 sheets.

Delivery was quick and the set of 25 pieces was packaged well.","{'feature': 'capacity of project-folders', 'actual_sentence_extracted': 'I think this might be able to hold around 15-20 sheets.', 'rephrased_it(without experience & observation)': 'The user mentioned that the sleeve can hold around 15-20 sheets.', 'sentiment': 'positive'}",capacity,The user mentioned that the sleeve can hold around 15-20 sheets.,,The sleeve can hold around 15-20 sheets.,490576,YES,The sleeve can hold around 15-20 sheets.,30,400653,2024-06-05T09:40:00.922759Z,2024-06-05T09:40:00.922809Z,3.66,YES,same
30f43fb2-bc47-11ed-a7ba-930ee103a0a2,0,5,"{""feature"":""durability of project-folders"", ""actual_sentence_extracted"":""I have carried around the binder with these in it for over a year and they still are in excellent condition."", ""rephrased_it(without experience & observation)"":""The user mentioned that he has carried the binder with these folders for over a year and they still are in excellent condition."", ""sentiment"":""positive""}",7,0,1.991000175476074,https://amazon.com/dp/B0838CLPF2,"I highly recommend these folders.  

They are surprisingly strong.  

I am able to stuff a lot of papers in them without issue.  

I have carried around the binder with these in it for over a year and they still are in excellent condition.  

I have a few things from this company and they are all high quality.","{'feature': 'durability of project-folders', 'actual_sentence_extracted': 'I have carried around the binder with these in it for over a year and they still are in excellent condition.', 'rephrased_it(without experience & observation)': 'The user mentioned that he has carried the binder with these folders for over a year and they still are in excellent condition.', 'sentiment': 'positive'}",durability,The user mentioned that he has carried the binder with these folders for over a year and they still are in excellent condition.,,I have carried this binder with these folders for over a year and they still are in excellent condition.,490575,YES,I have carried this binder with these folders for over a year and they still are in excellent condition.,30,400652,2024-06-05T09:39:55.688550Z,2024-06-05T09:39:55.688600Z,4.452,YES,same
30f43fb2-bc47-11ed-a7ba-930ee103a0a2,0,4,"{""feature"":""durability of project-folders"", ""actual_sentence_extracted"":""These folders are bright and colorful and sturdy to tolerate regular use."", ""rephrased_it(without experience & observation)"":""The user mentioned that the folders are bright, colorful and sturdy to tolerate regular use."", ""sentiment"":""positive""}",6,0,1.646121978759766,https://amazon.com/dp/B0838CLPF2,"These folders are bright and colorful and sturdy to tolerate regular use.

The pockets fit a good amount of papers.

The plastic folders are great also for use in situations when water or moisture could damage paper folders.  

Only problem with these folders is that the plastic is slippery and if folder is turned upside down, contents easily falls out.

There are holes punched into the folders, for placement in 3 ring binders.","{'feature': 'durability of project-folders', 'actual_sentence_extracted': 'These folders are bright and colorful and sturdy to tolerate regular use.', 'rephrased_it(without experience & observation)': 'The user mentioned that the folders are bright, colorful and sturdy to tolerate regular use.', 'sentiment': 'positive'}",durability,"The user mentioned that the folders are bright, colorful and sturdy to tolerate regular use.",,"The folders are bright, colorful, and sturdy enough for regular use.",490574,YES,"The folders are bright, colorful, and sturdy enough for regular use.",30,400651,2024-06-05T09:39:49.735876Z,2024-06-05T09:39:49.735927Z,4.64,YES,same
30f43fb2-bc47-11ed-a7ba-930ee103a0a2,0,5,"{""feature"":""durability of project-folders"", ""actual_sentence_extracted"":""The folders are very durable plastic material, not thin at all, and they will definitely last a lot longer than those paper like folders"", ""rephrased_it(without experience & observation)"":""The user mentioned that the folders are made of durable plastic material and will last longer than paper-like folders."", ""sentiment"":""positive""}",5,0,2.031569480895996,https://amazon.com/dp/B0838CLPF2,"These three hole pocket folders are very nice and perfect for organization.

You can use them in a binder or just by themselves.

I love the colors, they are very bold and vibrant, which makes it great to use them for different things and to keep them organized.

The folders are very durable plastic material, not thin at all, and they will definitely last a lot longer than those paper like folders.

I use them for my kids and also for my own personal use, and they have been great.","{'feature': 'durability of project-folders', 'actual_sentence_extracted': 'The folders are very durable plastic material, not thin at all, and they will definitely last a lot longer than those paper like folders', 'rephrased_it(without experience & observation)': 'The user mentioned that the folders are made of durable plastic material and will last longer than paper-like folders.', 'sentiment': 'positive'}",durability,The user mentioned that the folders are made of durable plastic material and will last longer than paper-like folders.,,Our folders are made of durable plastic material and will last longer than paper-like folders.,490573,YES,Our folders are made of durable plastic material and will last longer than paper-like folders.,30,400650,2024-06-05T09:39:42.767349Z,2024-06-05T09:39:42.767399Z,8.921,YES,same
30f43fb2-bc47-11ed-a7ba-930ee103a0a2,0,5,"{""feature"":""durability of project-folders"", ""actual_sentence_extracted"": ""These folders are made of durable, quality plastic material. They will not be prone to rip or easily fall apart, like the paper folders, and should last through the school year"", ""rephrased_it(without experience & observation)"":""The reviewer mentions that the folders are made of durable, quality plastic material and will not be prone to rip or easily fall apart, making them a good choice for long-term use."", ""sentiment"":""positive""}",4,0,2.680628776550293,https://amazon.com/dp/B0838CLPF2,"I use a lot of these 3 hole pocket folders to stay organized. They can be used either as standalone folders or in a binder. The assorted color scheme makes them useful to separate subjects in a notebook. This is the best way to organize important papers, projects and reports., These folders are made of durable, quality plastic material.  They will not be prone to rip or easily fall apart, like the paper folders, and should last through the school year. The three holes line up in a standard 3-ring binder, and are easy to load.  All in all, a great buy. These would be particularly useful for teachers and students.","{'feature': 'durability of project-folders', 'actual_sentence_extracted': 'These folders are made of durable, quality plastic material. They will not be prone to rip or easily fall apart, like the paper folders, and should last through the school year', 'rephrased_it(without experience & observation)': 'The reviewer mentions that the folders are made of durable, quality plastic material and will not be prone to rip or easily fall apart, making them a good choice for long-term use.', 'sentiment': 'positive'}",durability,"The reviewer mentions that the folders are made of durable, quality plastic material and will not be prone to rip or easily fall apart, making them a good choice for long-term use.",,"The folders are a good choice for long-term use as they are made of durable, quality plastic material and will not easily fall apart or rip.",490572,YES,"The folders are a good choice for long-term use as they are made of durable, quality plastic material and will not easily fall apart or rip.",30,400649,2024-06-05T09:39:31.214997Z,2024-06-05T09:39:31.215048Z,4.986,YES,same
30f43fb2-bc47-11ed-a7ba-930ee103a0a2,0,5,"{""feature"":""durability of project-folders"", ""actual_sentence_extracted"":""This is also where their quality and durability shines."", ""rephrased_it(without experience & observation)"":""The user mentioned that the quality and durability of the folders is exceptional."", ""sentiment"":""positive""}",2,0,1.544951200485229,https://amazon.com/dp/B0838CLPF2,"These organizational folders are of exceptional quality and serve multiple purposes.  

They are 3 hole punched to be used within such a binder or folder.  

This is also where their quality and durability shines.  

Many 3 hole punch folders are made of lesser quality since they will be used within another binder.  

These are instead strong folders that can be used on their own if you choose.  

I love the colors and the price is amazing.  

Great user friendly folders.","{'feature': 'durability of project-folders', 'actual_sentence_extracted': 'This is also where their quality and durability shines.', 'rephrased_it(without experience & observation)': 'The user mentioned that the quality and durability of the folders is exceptional.', 'sentiment': 'positive'}",durability,The user mentioned that the quality and durability of the folders is exceptional.,,The quality and durability of our folders are exceptional.,490571,NO,The quality and durability of our folders are exceptional.,30,400648,2024-06-05T09:39:22.757016Z,2024-06-05T09:39:22.757067Z,4.356,YES,different
30f43fb2-bc47-11ed-a7ba-930ee103a0a2,0,5,"""{'feature': 'durability of project-folders', 'actual_sentence_extracted': 'It is amazing how well these folders stand up to a year of use. They were actually in good enough condition at the end of the school year that I was able to reuse them the next school year.', 'rephrased_it(without experience & observation)': 'The user mentioned that the folders are durable and stood up to a year of use. They were in good condition at the end of the school year that he was able to reuse them the next school year.', 'sentiment': 'positive'}""",1,0,2.846694469451904,https://amazon.com/dp/B0838CLPF2,"My kids use poly folders for school and I legit love them.

It is amazing how well these folders stand up to a year of use.

They were actually in good enough condition at the end of the school year that I was able to reuse them the next school year.

The durability difference between these and paper folders does not even have a comparison.

, The price point for this particular set is a bit high, but generally Poly Folders are worth the extra cost moneywise.","{'feature': 'durability of project-folders', 'actual_sentence_extracted': 'It is amazing how well these folders stand up to a year of use. They were actually in good enough condition at the end of the school year that I was able to reuse them the next school year.', 'rephrased_it(without experience & observation)': 'The user mentioned that the folders are durable and stood up to a year of use. They were in good condition at the end of the school year that he was able to reuse them the next school year.', 'sentiment': 'positive'}",durability,The user mentioned that the folders are durable and stood up to a year of use. They were in good condition at the end of the school year that he was able to reuse them the next school year.,,"The folders I used were durable and in good condition even after a year of use, allowing me to reuse them the next school year.",490570,YES,"The folders I used were durable and in good condition even after a year of use, allowing me to reuse them the next school year.",30,400647,2024-06-05T09:39:16.765357Z,2024-06-05T09:39:16.765407Z,8.42,YES,same
30f43fb2-bc47-11ed-a7ba-930ee103a0a2,0,5,"{""feature"":""closure mechanism of project-folders"", ""actual_sentence_extracted"":None, ""rephrased_it(without experience & observation)"":""The user has not mentioned anything about the closure mechanism of the project folders."", ""sentiment"":""neutral""}",6,0,1.372947931289673,https://amazon.com/dp/B0838CLPF2,"""I needed plastic folders as part of my childs school supplies.

This 6 pack has 6 different colored folders and 6 labels.  

Each folder already has the 3 holes punched.

Inside are two beveled pockets, one has slits for a business card or other label.

"", These seem very thick and able to withstand the wrath of a 5 year old for a whole school year.

, Overall very satisfied with the folders and color options.","{'feature': 'closure mechanism of project-folders', 'actual_sentence_extracted': None, 'rephrased_it(without experience & observation)': 'The user has not mentioned anything about the closure mechanism of the project folders.', 'sentiment': 'neutral'}",closure mechanism,The user has not mentioned anything about the closure mechanism of the project folders.,,I haven't mentioned anything about the closure mechanism of the project folders.,490569,NO,I haven't mentioned anything about the closure mechanism of the project folders.,30,400646,2024-06-05T09:39:06.700249Z,2024-06-05T09:39:06.700301Z,20.915,OTHER,different
30f43fb2-bc47-11ed-a7ba-930ee103a0a2,0,5,"{""feature"":""capacity of project-folders"", ""actual_sentence_extracted"":""I am able to stuff a lot of papers in them without issue."", ""rephrased_it(without experience & observation)"":""The user mentioned that he is able to put a lot of papers in them without any issue."", ""sentiment"":""positive""}",8,0,1.683587551116943,https://amazon.com/dp/B0838CLPF2,"I highly recommend these folders.  

They are surprisingly strong.  

I am able to stuff a lot of papers in them without issue.  

I have carried around the binder with these in it for over a year and they still are in excellent condition.  

I have a few things from this company and they are all high quality.","{'feature': 'capacity of project-folders', 'actual_sentence_extracted': 'I am able to stuff a lot of papers in them without issue.', 'rephrased_it(without experience & observation)': 'The user mentioned that he is able to put a lot of papers in them without any issue.', 'sentiment': 'positive'}",capacity,The user mentioned that he is able to put a lot of papers in them without any issue.,,I am able to put a lot of papers in them without any issue.,490568,YES,I am able to put a lot of papers in them without any issue.,30,400645,2024-06-05T09:38:44.297613Z,2024-06-05T09:38:44.297663Z,4.819,YES,same
534b797c-8cba-11ed-a7ba-930ee103a0a2,4,5,"{""feature"":""portability of project-folders"", ""actual_sentence_extracted"":""The colors make it easy at a glance to arrange by subject or project."", ""rephrased_it(without experience & observation)"":""The user mentioned that the colors of the folders make it easy to arrange by subject or project."", ""sentiment"":""positive""}",2,0,1.722346067428589,https://amazon.com/dp/B0734V7GRB,"Set of 25 two-pocket folders with fasteners--five each of yellow, red, orange, green and blue.

Constructed from paper reminiscent of the weight of poster board, oak tag board or cover stock.

They feature a three-hole center strip with metal fasteners to secure papers along with two large horizontal pockets on both sides of the interior along with a die-cut portion to hold a business card or title card.

,

The colors make it easy at a glance to arrange by subject or project.","{'feature': 'portability of project-folders', 'actual_sentence_extracted': 'The colors make it easy at a glance to arrange by subject or project.', 'rephrased_it(without experience & observation)': 'The user mentioned that the colors of the folders make it easy to arrange by subject or project.', 'sentiment': 'positive'}",portability,The user mentioned that the colors of the folders make it easy to arrange by subject or project.,,Arranging folders by subject or project is easy with the different colors available.,490567,Other,Arranging folders by subject or project is easy with the different colors available.,30,400644,2024-06-05T09:38:37.815813Z,2024-06-05T09:38:37.815879Z,6.935,NO,different
534b797c-8cba-11ed-a7ba-930ee103a0a2,0,4,"""{'feature': 'durability of project-folders', 'actual_sentence_extracted': 'The folder itself is not really heavy grade so I doubt it will last long if filled to its claimed capacity of 135 sheets', 'rephrased_it(without experience & observation)': 'The reviewer doubts the durability of the folder, stating that it is not heavy grade and will not last long if filled to its claimed capacity of 135 sheets.', 'sentiment': 'negative'}""",2,0,2.459570169448853,https://amazon.com/dp/B0734V7GRB,  These Amazon Basics folders are a decent solution for school or general file organization.  They feature 2 pockets on the interior along with a center flap with  metal fasteners that can be used to hold a claimed 135 sheets of 3 hole punch paper.  Overall it works well but the quality is a bit below some of the competition.  The folder itself is not really heavy grade so I doubt it will last long if filled to its claimed capacity of 135 sheets.  The inner pockets are decent but the small lip seems like it won’t hold more than a few sheets before it gives.  This would still be acceptable if the price was much cheaper than the competition but at the current price this works out to be just over 50 cents a folder which is only slightly cheaper than the more heavy duty name brand folders (when they are on sale).  Overall these are are a good solution for home use but if you need something durable then you can spend a bit more and get something that will last much longer.,"{'feature': 'durability of project-folders', 'actual_sentence_extracted': 'The folder itself is not really heavy grade so I doubt it will last long if filled to its claimed capacity of 135 sheets', 'rephrased_it(without experience & observation)': 'The reviewer doubts the durability of the folder, stating that it is not heavy grade and will not last long if filled to its claimed capacity of 135 sheets.', 'sentiment': 'negative'}",durability,"The reviewer doubts the durability of the folder, stating that it is not heavy grade and will not last long if filled to its claimed capacity of 135 sheets.",,I doubt the durability of the folder as it is not heavy grade and will not last long if filled to its claimed capacity of 135 sheets.,490566,YES,I doubt the durability of the folder as it is not heavy grade and will not last long if filled to its claimed capacity of 135 sheets.,30,400643,2024-06-05T09:38:29.099618Z,2024-06-05T09:38:29.099669Z,6.561,YES,same
534b797c-8cba-11ed-a7ba-930ee103a0a2,0,5,"{""feature"":""closure mechanism of project-folders"", ""actual_sentence_extracted"":""The folders have inside pockets on both sides that perfectly fit 8.5x11 sheets."", ""rephrased_it(without experience & observation)"":""The user mentioned that the folders have inside pockets on both sides that perfectly fit 8.5x11 sheets."", ""sentiment"":""positive""}",3,0,1.896883487701416,https://amazon.com/dp/B0734V7GRB,"Amazon Basics brand does me well yet again!

I love this brand and I’ve been snapping up their office supplies as of yet.

These folders are great, as well.

They come in vibrant colors.

Note that most bright colors fade over time, but I cannot yet attest to this with this particular brand.

The folders have inside pockets on both sides that perfectly fit 8.5x11 sheets.

I love that they come in a 25 pack, as well.","{'feature': 'closure mechanism of project-folders', 'actual_sentence_extracted': 'The folders have inside pockets on both sides that perfectly fit 8.5x11 sheets.', 'rephrased_it(without experience & observation)': 'The user mentioned that the folders have inside pockets on both sides that perfectly fit 8.5x11 sheets.', 'sentiment': 'positive'}",closure mechanism,The user mentioned that the folders have inside pockets on both sides that perfectly fit 8.5x11 sheets.,,The folders have inside pockets on both sides that perfectly fit 8.5x11 sheets.,490565,NO,The folders have inside pockets on both sides that perfectly fit 8.5x11 sheets.,30,400642,2024-06-05T09:38:20.815255Z,2024-06-05T09:38:20.815306Z,7.172,OTHER,different
534b797c-8cba-11ed-a7ba-930ee103a0a2,0,1,"{""feature"":""closure mechanism of project-folders"", ""actual_sentence_extracted"":""Unfortunately, the prongs in the folders dont line up with the holes on the reinforcement tabs, so its impossible to place the paper inside without it bunching and affecting the ability of the folder to close properly."", ""rephrased_it(without experience & observation)"":""The user mentioned that the prongs in the folders dont line up with the holes on the reinforcement tabs, which makes it impossible to place the paper inside without it bunching and affecting the ability of the folder to close properly."", ""sentiment"":""negative""}",2,0,2.844758749008179,https://amazon.com/dp/B0734V7GRB,"""  I ordered these for my class to use as journals.

Unfortunately, the prongs in the folders dont line up with the holes on the reinforcement tabs, so its impossible to place the paper inside without it bunching and affecting the ability of the folder to close properly.

Spend the extra cash and go with Five Star folders!""","{'feature': 'closure mechanism of project-folders', 'actual_sentence_extracted': 'Unfortunately, the prongs in the folders dont line up with the holes on the reinforcement tabs, so its impossible to place the paper inside without it bunching and affecting the ability of the folder to close properly.', 'rephrased_it(without experience & observation)': 'The user mentioned that the prongs in the folders dont line up with the holes on the reinforcement tabs, which makes it impossible to place the paper inside without it bunching and affecting the ability of the folder to close properly.', 'sentiment': 'negative'}",closure mechanism,"The user mentioned that the prongs in the folders dont line up with the holes on the reinforcement tabs, which makes it impossible to place the paper inside without it bunching and affecting the ability of the folder to close properly.",,"I can't place the paper inside the folder properly because the prongs don't line up with the holes on the reinforcement tabs, which affects the folder's ability to close properly.",490564,YES,"I can't place the paper inside the folder properly because the prongs don't line up with the holes on the reinforcement tabs, which affects the folder's ability to close properly.",30,400641,2024-06-05T09:38:10.522115Z,2024-06-05T09:38:10.522170Z,6.489,YES,same
