Pid,is_helpful,rating,Actual Response,Review Number,Cost per review,Time Taken,amazon_page,Review text,Rephrased Snippets,aspect,QA_Content,Accept,Processed_QA_Content,id,accept_choice1,accept1,annotator,annotation_id,created_at,updated_at,lead_time,Model_choice,compare
62990268-bc11-11ed-a7ba-930ee103a0a2,0,5,"{""feature"":""durability of project-folders"", ""actual_sentence_extracted"":""They are made of thin plastic and very flexible, but they feel quite sturdy and durable."", ""rephrased_it(without experience & observation)"":""The user mentioned that the folders are made of thin plastic and are flexible, but they feel quite sturdy and durable."", ""sentiment"":""positive""}",4,0,1.876487970352173,https://amazon.com/dp/B07K91VP1Y,"These 3-Hole Punched Pocket Folders are handy for keeping your documents organized.

They are made of thin plastic and very flexible, but they feel quite sturdy and durable.

They come in a very useful assortment of colors for color-coding your workflow., ""If youre looking for 3-Hole Punched Pocket Folders for organizing your documents, these are a good bet.""","{'feature': 'durability of project-folders', 'actual_sentence_extracted': 'They are made of thin plastic and very flexible, but they feel quite sturdy and durable.', 'rephrased_it(without experience & observation)': 'The user mentioned that the folders are made of thin plastic and are flexible, but they feel quite sturdy and durable.', 'sentiment': 'positive'}",durability,"The user mentioned that the folders are made of thin plastic and are flexible, but they feel quite sturdy and durable.",,The folders feel quite sturdy and durable despite being made of thin plastic and being flexible.,490535,YES,The folders feel quite sturdy and durable despite being made of thin plastic and being flexible.,30,400463,2024-06-05T09:05:34.478912Z,2024-06-05T09:05:34.478965Z,4.346,YES,same
62990268-bc11-11ed-a7ba-930ee103a0a2,0,5,"{""feature"":""durability of project-folders"", ""actual_sentence_extracted"":""These binder folders are great. Theyre made of a very durable plastic that will withstand regular use."", ""rephrased_it(without experience & observation)"":""The user mentioned that the binder folders are made of durable plastic and will withstand regular use."", ""sentiment"":""positive""}",3,0,1.810977458953857,https://amazon.com/dp/B07K91VP1Y,"""These binder folders are great.

Theyre made of a very durable plastic that will withstand regular use.

The hole punches will also hold up and inside fits regular 8 1/2 x 11 paper .

The folder inside is reinforced on one side and open on the other, which makes it easy to slide papers in and out.

This set comes in red, orange, yellow, green, blue, and purple.

Great set!""","{'feature': 'durability of project-folders', 'actual_sentence_extracted': 'These binder folders are great. Theyre made of a very durable plastic that will withstand regular use.', 'rephrased_it(without experience & observation)': 'The user mentioned that the binder folders are made of durable plastic and will withstand regular use.', 'sentiment': 'positive'}",durability,The user mentioned that the binder folders are made of durable plastic and will withstand regular use.,,The binder folders are made of durable plastic and will withstand regular use.,490534,YES,The binder folders are made of durable plastic and will withstand regular use.,30,400461,2024-06-05T09:05:28.874882Z,2024-06-05T09:05:28.874933Z,3.433,YES,same
62990268-bc11-11ed-a7ba-930ee103a0a2,33,4,"""{'feature': 'durability of project-folders', 'actual_sentence_extracted': 'These folders are in between.  They are still flimsy like the cheap ones for $0.50, but they feel more durable than those Walmart folders but not quite on par with Five Star', 'rephrased_it(without experience & observation)':'The user has mentioned that these folders are in between in terms of durability. They are still flimsy like the cheap ones for $0.50, but they feel more durable than those Walmart folders but not quite on par with Five Star.', 'sentiment':'neutral'}""",1,0,3.121280431747437,https://amazon.com/dp/B07K91VP1Y,"""Like someone else has said, when I think about heavy duty, I think about the Mead Five Star folders.  Those folders actually feel sturdy. These folders are in between.  They are still flimsy like the cheap ones for $0.50, but they feel more durable than those Walmart folders but not quite on par with Five Star (I have comparison pictures. You can see the Five Star folder through the Amazon one, but not vice versa). I hope these will last my sister throughout the school year and longer because that was the purpose of buying them. If they start tearing before the school year finishes, Ill just buy Five Star folders and spend a little more.  The focus on these folders are more on durability than sturdiness.""","{'feature': 'durability of project-folders', 'actual_sentence_extracted': 'These folders are in between.  They are still flimsy like the cheap ones for $0.50, but they feel more durable than those Walmart folders but not quite on par with Five Star', 'rephrased_it(without experience & observation)': 'The user has mentioned that these folders are in between in terms of durability. They are still flimsy like the cheap ones for $0.50, but they feel more durable than those Walmart folders but not quite on par with Five Star.', 'sentiment': 'neutral'}",durability,"The user has mentioned that these folders are in between in terms of durability. They are still flimsy like the cheap ones for $0.50, but they feel more durable than those Walmart folders but not quite on par with Five Star.",,"These folders are somewhat durable, not as flimsy as the cheap ones but not as good as Five Star.",490533,YES,"These folders are somewhat durable, not as flimsy as the cheap ones but not as good as Five Star.",30,400460,2024-06-05T09:05:24.304275Z,2024-06-05T09:05:24.304325Z,5.575,NO,different
62990268-bc11-11ed-a7ba-930ee103a0a2,5,5,"{""feature"":""closure mechanism of project-folders"", ""actual_sentence_extracted"":""I got the folder and then was ready to put it away for safe keeping. But I peeked one more time to make sure that nothing was wrinkled after the last closing"", ""rephrased_it(without experience & observation)"":""The user mentioned that he checked the folder one more time after closing it to make sure that nothing was wrinkled. This indicates that the closure mechanism of the folder is reliable and the user has experienced it personally."", ""sentiment"":""positive""}",4,0,2.81295919418335,https://amazon.com/dp/B07K91VP1Y,"I had 18 really important papers that I wanted to keep together in the same place. I also wanted them to be protected so that they would not be easily bent, folded, or otherwise compromised. I took these folders out of the box and removed the yellow one. I opened and closed it a few times to make sure that it would keep the papers safe. I then added 9 papers to each side of the folder to give it a test run. Nothing was wrinkled in the slightest. Each paper looked exactly as it did when I inserted it into its pocket. I was ready for my important papers. After some hesitation, I put them in. Nine on each side as with the practice run. I was going to just put them away for safe keeping, but I peeked once to make sure that nothing got wrinkled. Everything looked wonderful. I got the folder and then was ready to put it away for safe keeping. But I peeked one more time to make sure that nothing was wrinkled after the last closing. Thankfully, nothing was damaged. As I mentioned earlier, these are important papers., I have 5 other folders so I could conceivably store 90 more important papers if the need should arise. I couldn’t be happier with my choice at this point. Should I ever need access to one of my documents, I will update this review to let everyone know if they stayed safe, flat, and clean over time.","{'feature': 'closure mechanism of project-folders', 'actual_sentence_extracted': 'I got the folder and then was ready to put it away for safe keeping. But I peeked one more time to make sure that nothing was wrinkled after the last closing', 'rephrased_it(without experience & observation)': 'The user mentioned that he checked the folder one more time after closing it to make sure that nothing was wrinkled. This indicates that the closure mechanism of the folder is reliable and the user has experienced it personally.', 'sentiment': 'positive'}",closure mechanism,The user mentioned that he checked the folder one more time after closing it to make sure that nothing was wrinkled. This indicates that the closure mechanism of the folder is reliable and the user has experienced it personally.,,I checked the folder one more time after closing it to make sure that nothing was wrinkled. This indicates that the closure mechanism of the folder is reliable and I have experienced it personally.,490532,NO,I checked the folder one more time after closing it to make sure that nothing was wrinkled. This indicates that the closure mechanism of the folder is reliable and I have experienced it personally.,30,400458,2024-06-05T09:05:17.261310Z,2024-06-05T09:05:17.261362Z,5.411,YES,different
62990268-bc11-11ed-a7ba-930ee103a0a2,0,4,"{""feature"":""closure mechanism of project-folders"", ""actual_sentence_extracted"":""My only complaint (which knocked it down a star) is that they don’t close completely."", ""rephrased_it(without experience & observation)"":""The user mentioned that the folder does not close completely and it is his only complaint."", ""sentiment"":""negative""}",3,0,1.769623041152954,https://amazon.com/dp/B07K91VP1Y,"These folders are sturdy and work well.

My only complaint (which knocked it down a star) is that they don’t close completely.

Because they are made of a thicker plastic, the clip strip down the middle makes it impossible for the folder to close all the way.

Its not a big issue, just a little annoying.","{'feature': 'closure mechanism of project-folders', 'actual_sentence_extracted': 'My only complaint (which knocked it down a star) is that they don’t close completely.', 'rephrased_it(without experience & observation)': 'The user mentioned that the folder does not close completely and it is his only complaint.', 'sentiment': 'negative'}",closure mechanism,The user mentioned that the folder does not close completely and it is his only complaint.,,My only complaint is that the folder does not close completely.,490531,YES,My only complaint is that the folder does not close completely.,30,400457,2024-06-05T09:05:10.682238Z,2024-06-05T09:05:10.682289Z,3.266,YES,same
62990268-bc11-11ed-a7ba-930ee103a0a2,0,4,"{""feature"":""closure mechanism of project-folders"", ""actual_sentence_extracted"":""I would have liked the pockets to be completely closed rather than open at the center fold so that smaller papers stayed in the correct pocket rather than slipping out of the folder."", ""rephrased_it(without experience & observation)"":""The user expressed a preference for the pockets to be completely closed rather than open at the center fold, in order to keep smaller papers from slipping out of the folder."", ""sentiment"":""neutral""}",1,0,2.415545463562012,https://amazon.com/dp/B07K91VP1Y,"These ""AmazonBasics Heavy Duty Plastic 2 Pocket Folder for Letter Size Paper"" have proven to be the solution to that problem.  

They are sturdy; I can put a label on the front  that I can remove when the trip is over and then reuse the folder for the next vacation.  

I would have liked the pockets to be completely closed rather than open at the center fold so that smaller papers stayed in the correct pocket rather than slipping out of the folder.","{'feature': 'closure mechanism of project-folders', 'actual_sentence_extracted': 'I would have liked the pockets to be completely closed rather than open at the center fold so that smaller papers stayed in the correct pocket rather than slipping out of the folder.', 'rephrased_it(without experience & observation)': 'The user expressed a preference for the pockets to be completely closed rather than open at the center fold, in order to keep smaller papers from slipping out of the folder.', 'sentiment': 'neutral'}",closure mechanism,"The user expressed a preference for the pockets to be completely closed rather than open at the center fold, in order to keep smaller papers from slipping out of the folder.",,I prefer the pockets to be completely closed instead of open at the center fold to prevent smaller papers from slipping out of the folder.,490530,YES,I prefer the pockets to be completely closed instead of open at the center fold to prevent smaller papers from slipping out of the folder.,30,400455,2024-06-05T09:05:06.262206Z,2024-06-05T09:05:06.262260Z,20.705,YES,same
20e8e0bc-bc17-11ed-a7ba-930ee103a0a2,0,5,"{""feature"":""portability of project-folders"", ""actual_sentence_extracted"":""I dislike binders because of their bulk so I tried this out and it’s awesome!"", ""rephrased_it(without experience & observation)"":""The user mentioned that they dislike binders because of their bulk and tried this out and found it to be awesome. This indicates that the user found the product to be portable and easy to use."", ""sentiment"":""positive""}",7,0,2.20734167098999,https://amazon.com/dp/B01LVUEM19,"I dislike binders because of their bulk so I tried this out and it’s awesome!  

A lot of other reviews say that it’s flimsy but I used it my whole junior year and it was as damaged as a binder would be.  

The edges of the folders were kinda bent and about a 1/2 cm tear

but that’s all just wear and tear.  

As long as you don’t over use it aka put way too much in the pockets it will be fine.","{'feature': 'portability of project-folders', 'actual_sentence_extracted': 'I dislike binders because of their bulk so I tried this out and it’s awesome!', 'rephrased_it(without experience & observation)': 'The user mentioned that they dislike binders because of their bulk and tried this out and found it to be awesome. This indicates that the user found the product to be portable and easy to use.', 'sentiment': 'positive'}",portability,The user mentioned that they dislike binders because of their bulk and tried this out and found it to be awesome. This indicates that the user found the product to be portable and easy to use.,,"I dislike binders because of their bulk, but I tried this product and found it to be awesome. It is portable and easy to use.",490529,YES,"I dislike binders because of their bulk, but I tried this product and found it to be awesome. It is portable and easy to use.",30,400453,2024-06-05T09:04:43.161510Z,2024-06-05T09:04:43.161562Z,9.49,YES,same
20e8e0bc-bc17-11ed-a7ba-930ee103a0a2,0,5,"{""feature"":""portability of project-folders"", ""actual_sentence_extracted"":""This folder is sturdy, useful, easy to handle, lends itself to many home office or school purposes and can be re-used indefinitely."", ""rephrased_it(without experience & observation)"":""The user mentioned that the folder is sturdy, useful, easy to handle, and can be reused indefinitely. It is also suitable for many home office or school purposes."", ""sentiment"":""positive""}",4,0,2.266686201095581,https://amazon.com/dp/B01LVUEM19,"Excellent product!.  

How gratifying to order something that turns out to be exactly what you need.  

This folder is sturdy, useful, easy to handle, lends itself to many home office or school purposes and can be re-used indefinitely.  

Neither hot coffee nor sticky fingers leave lasting damage.  

Sections can be labeled for different subjects.","{'feature': 'portability of project-folders', 'actual_sentence_extracted': 'This folder is sturdy, useful, easy to handle, lends itself to many home office or school purposes and can be re-used indefinitely.', 'rephrased_it(without experience & observation)': 'The user mentioned that the folder is sturdy, useful, easy to handle, and can be reused indefinitely. It is also suitable for many home office or school purposes.', 'sentiment': 'positive'}",portability,"The user mentioned that the folder is sturdy, useful, easy to handle, and can be reused indefinitely. It is also suitable for many home office or school purposes.",,"The folder is sturdy, useful, easy to handle, and can be reused indefinitely. It is also suitable for many home office or school purposes.",490528,Other,"The folder is sturdy, useful, easy to handle, and can be reused indefinitely. It is also suitable for many home office or school purposes.",30,400452,2024-06-05T09:04:32.297319Z,2024-06-05T09:04:32.297373Z,5.89,YES,different
20e8e0bc-bc17-11ed-a7ba-930ee103a0a2,0,5,"{""feature"":""durability of project-folders"", ""actual_sentence_extracted"":""This folder is sturdy, useful, easy to handle, lends itself to many home office or school purposes and can be re-used indefinitely."", ""rephrased_it(without experience & observation)"":""The user mentioned that the folder is sturdy, useful, easy to handle and can be reused indefinitely."", ""sentiment"":""positive""}",7,0,2.004984140396118,https://amazon.com/dp/B01LVUEM19,"Excellent product!.  

How gratifying to order something that turns out to be exactly what you need.  

This folder is sturdy, useful, easy to handle, lends itself to many home office or school purposes and can be re-used indefinitely.  

Neither hot coffee nor sticky fingers leave lasting damage.  

Sections can be labeled for different subjects.","{'feature': 'durability of project-folders', 'actual_sentence_extracted': 'This folder is sturdy, useful, easy to handle, lends itself to many home office or school purposes and can be re-used indefinitely.', 'rephrased_it(without experience & observation)': 'The user mentioned that the folder is sturdy, useful, easy to handle and can be reused indefinitely.', 'sentiment': 'positive'}",durability,"The user mentioned that the folder is sturdy, useful, easy to handle and can be reused indefinitely.",,"The folder is sturdy, useful, easy to handle, and can be reused indefinitely.",490527,YES,"The folder is sturdy, useful, easy to handle, and can be reused indefinitely.",30,400451,2024-06-05T09:04:25.077259Z,2024-06-05T09:04:25.077311Z,2.844,YES,same
20e8e0bc-bc17-11ed-a7ba-930ee103a0a2,0,5,"""{'feature': 'durability of project-folders', 'actual_sentence_extracted': 'The folders for past years have NOT become brittle with age.', 'rephrased_it(without experience & observation)': 'The user mentioned that the folders have not become brittle with age, indicating that they are durable.', 'sentiment': 'positive'}""",6,0,1.769903898239136,https://amazon.com/dp/B01LVUEM19,"I have ordered these before.  

I use them throughout the year for our medical records so they are opened and closed often.  

They are sturdy but still lightweight.

The spine is wide enough for a small label so I can mark each year and stand them up on a shelf.

The folders for past years have NOT become brittle with age.","{'feature': 'durability of project-folders', 'actual_sentence_extracted': 'The folders for past years have NOT become brittle with age.', 'rephrased_it(without experience & observation)': 'The user mentioned that the folders have not become brittle with age, indicating that they are durable.', 'sentiment': 'positive'}",durability,"The user mentioned that the folders have not become brittle with age, indicating that they are durable.",,The folders are durable as they have not become brittle with age.,490526,YES,The folders are durable as they have not become brittle with age.,30,400450,2024-06-05T09:04:20.925034Z,2024-06-05T09:04:20.925084Z,4.734,YES,same
20e8e0bc-bc17-11ed-a7ba-930ee103a0a2,0,5,"{""feature"":""durability of project-folders"", ""actual_sentence_extracted"":""Been going strong for ~2 years now."", ""rephrased_it(without experience & observation)"":""The user mentioned that the folder has been durable for about 2 years now."", ""sentiment"":""positive""}",5,0,1.534700393676758,https://amazon.com/dp/B01LVUEM19,"""I bought this folder so that I could have different sections for each of the classes I am taking.

Its perfect for handouts, homework, or whatever else you want to take with you back and forth to school.

Also has a slim profile and is sturdy, which is important to me.

The only problem I had is that some of the folder pocket corners got folded over where they meet the inside of the spine of the folder.

Not a big deal.

Been going strong for ~2 years now.""","{'feature': 'durability of project-folders', 'actual_sentence_extracted': 'Been going strong for ~2 years now.', 'rephrased_it(without experience & observation)': 'The user mentioned that the folder has been durable for about 2 years now.', 'sentiment': 'positive'}",durability,The user mentioned that the folder has been durable for about 2 years now.,,The folder has been durable for about 2 years now.,490525,YES,The folder has been durable for about 2 years now.,30,400449,2024-06-05T09:04:14.908513Z,2024-06-05T09:04:14.908564Z,3.303,YES,same
20e8e0bc-bc17-11ed-a7ba-930ee103a0a2,0,5,"{""feature"":""durability of project-folders"", ""actual_sentence_extracted"": ""A lot of other reviews say that it’s flimsy but I used it my whole junior year and it was as damaged as a binder would be."", ""rephrased_it(without experience & observation)"":""The user mentioned that despite other reviews stating that the folder is flimsy, he used it throughout his junior year and it was as damaged as a binder would be. This indicates that the user has used the folder and has found it to be durable based on his experience."", ""sentiment"":""positive""}",3,0,2.975713014602661,https://amazon.com/dp/B01LVUEM19,I dislike binders because of their bulk so I tried this out and it’s awesome!  A lot of other reviews say that it’s flimsy but I used it my whole junior year and it was as damaged as a binder would be.  The edges of the folders were kinda bent and about a 1/2 cm tear but that’s all just wear and tear.  As long as you don’t over use it aka put way too much in the pockets it will be fine.  Idkkk maybe a rough estimate of how much paper I kept in one pocket the most was 50 pages probably.  I don’t like carrying around extra weight so I remove papers I don’t need anymore which makes the folder lighter and last longer.,"{'feature': 'durability of project-folders', 'actual_sentence_extracted': 'A lot of other reviews say that it’s flimsy but I used it my whole junior year and it was as damaged as a binder would be.', 'rephrased_it(without experience & observation)': 'The user mentioned that despite other reviews stating that the folder is flimsy, he used it throughout his junior year and it was as damaged as a binder would be. This indicates that the user has used the folder and has found it to be durable based on his experience.', 'sentiment': 'positive'}",durability,"The user mentioned that despite other reviews stating that the folder is flimsy, he used it throughout his junior year and it was as damaged as a binder would be. This indicates that the user has used the folder and has found it to be durable based on his experience.",,"I used the folder throughout my junior year and found it to be as durable as a binder, despite other reviews stating it is flimsy.",490524,YES,"I used the folder throughout my junior year and found it to be as durable as a binder, despite other reviews stating it is flimsy.",30,400448,2024-06-05T09:04:05.377662Z,2024-06-05T09:04:05.377713Z,4.575,YES,same
20e8e0bc-bc17-11ed-a7ba-930ee103a0a2,0,5,"""{'feature': 'durability of project-folders', 'actual_sentence_extracted': 'Nice outer plastic covering. Very sturdy.', 'rephrased_it(without experience & observation)': 'The user mentioned that the outer plastic covering is nice and sturdy.', 'sentiment': 'positive'}""",2,0,1.684943675994873,https://amazon.com/dp/B01LVUEM19,"Nice outer plastic covering.  

Very sturdy.  

Has 4 divided areas (front and back), plus pockets on both the front and back covers.  

The inside pockets are riveted in, so they will not fall out.  

It also comes with the little things you put in the slots to name the dividers.  

Love that it comes in a variety of colors.  

Like it so much thinking about purchasing more.","{'feature': 'durability of project-folders', 'actual_sentence_extracted': 'Nice outer plastic covering. Very sturdy.', 'rephrased_it(without experience & observation)': 'The user mentioned that the outer plastic covering is nice and sturdy.', 'sentiment': 'positive'}",durability,The user mentioned that the outer plastic covering is nice and sturdy.,,The outer plastic covering is nice and sturdy.,490523,NO,The outer plastic covering is nice and sturdy.,30,400446,2024-06-05T09:03:58.921665Z,2024-06-05T09:03:58.921716Z,3.047,YES,different
