Pid,is_helpful,rating,Actual Response,Review Number,Cost per review,Time Taken,amazon_page,Review text,Rephrased Snippets,aspect,QA_Content,Accept,Processed_QA_Content,id,accept_choice1,accept1,annotator,annotation_id,created_at,updated_at,lead_time,Model_choice,compare
489974c4-bc48-11ed-a7ba-930ee103a0a2,0,5,"{""feature"":""organization of project-folders"", ""actual_sentence_extracted"":""This is great for keeping papers organized that you need to go back to for info, and its also sturdier than most flimsy plastic or cardboard folders, as well."", ""rephrased_it(without experience & observation)"":""The user mentioned that this product is great for keeping papers organized that you need to go back to for information, and it is sturdier than most flimsy plastic or cardboard folders."", ""sentiment"":""positive""}",2,0,2.55217170715332,https://amazon.com/dp/B08WPZY67V,"""Typical plastic pocket folders are ok, but this meets my needs better for course work, as well as for organizations that I belong to (where I have info forms and other paperwork that I need to occasionally refer to).  

This is great for keeping papers organized that you need to go back to for info, and its also sturdier than most flimsy plastic or cardboard folders, as well.","{'feature': 'organization of project-folders', 'actual_sentence_extracted': 'This is great for keeping papers organized that you need to go back to for info, and its also sturdier than most flimsy plastic or cardboard folders, as well.', 'rephrased_it(without experience & observation)': 'The user mentioned that this product is great for keeping papers organized that you need to go back to for information, and it is sturdier than most flimsy plastic or cardboard folders.', 'sentiment': 'positive'}",organization,"The user mentioned that this product is great for keeping papers organized that you need to go back to for information, and it is sturdier than most flimsy plastic or cardboard folders.",,This product is great for organizing papers that I need to refer back to and is sturdier than most flimsy folders.,490617,YES,This product is great for organizing papers that I need to refer back to and is sturdier than most flimsy folders.,30,400698,2024-06-05T09:47:28.457519Z,2024-06-05T09:47:28.457570Z,3.745,NO,different
489974c4-bc48-11ed-a7ba-930ee103a0a2,6,4,"{""feature"":""durability of project-folders"", ""actual_sentence_extracted"": ""The outer plastic cover and backing is sturdy enough for me to not worry about the contents getting bent"", ""rephrased_it(without experience & observation)"":""The reviewer mentioned that the outer plastic cover and backing is sturdy enough to keep the contents safe from bending."", ""sentiment"":""positive""}",5,0,2.023823261260986,https://amazon.com/dp/B08WPZY67V,"""This spiral portfolio is serving its purpose in helping me to have a convenient way to store some inkjet printed projects on glossy photo paper safely. The angled pockets are a good thickness that dont require as much precision as top loading pockets, and yet seem to be keeping all the various sizes, some quite small, safe and unbent."", The outer plastic cover and backing is sturdy enough for me to not worry about the contents getting bent, and the spiral binding is large and easy to access my stuff easily. A portion of my prints is exposed and not protected by the pocket, but since the preceding pocket page has only one pocket size, the back is smooth, which helps to protect the front of my papers., ""If including the inner front and back cover pockets, there are 10 pockets total (8 clear page pockets). I like that this isnt very flimsy, and I do feel comfortable using this to store my delicate art prints until I utilize them. Thanks for reading.""","{'feature': 'durability of project-folders', 'actual_sentence_extracted': 'The outer plastic cover and backing is sturdy enough for me to not worry about the contents getting bent', 'rephrased_it(without experience & observation)': 'The reviewer mentioned that the outer plastic cover and backing is sturdy enough to keep the contents safe from bending.', 'sentiment': 'positive'}",durability,The reviewer mentioned that the outer plastic cover and backing is sturdy enough to keep the contents safe from bending.,,The outer plastic cover and backing are sturdy enough to keep the contents safe from bending.,490616,YES,The outer plastic cover and backing are sturdy enough to keep the contents safe from bending.,30,400699,2024-06-05T09:47:36.024329Z,2024-06-05T09:47:36.024381Z,4.691,YES,same
489974c4-bc48-11ed-a7ba-930ee103a0a2,0,5,"{""feature"":""durability of project-folders"", ""actual_sentence_extracted"":""I know I can use it and not worry about losing anything."", ""rephrased_it(without experience & observation)"":""The user mentioned that he is confident that he can use it without worrying about losing anything."", ""sentiment"":""positive""}",4,0,1.667153596878052,https://amazon.com/dp/B08WPZY67V,"I got this to hold some important documents for safe keeping.

I love how the edges are really strong.

I know I can use it and not worry about losing anything.

They are clear and I am able to see everything inside., ""The outside cover is very sturdy so I know I dont have to worry about anything getting bent.

The 8 pockets open at the top, which is added security.

"", It is very professional looking, so I can use it for work or school.

Definitely worth the price and it shipped really fast.","{'feature': 'durability of project-folders', 'actual_sentence_extracted': 'I know I can use it and not worry about losing anything.', 'rephrased_it(without experience & observation)': 'The user mentioned that he is confident that he can use it without worrying about losing anything.', 'sentiment': 'positive'}",durability,The user mentioned that he is confident that he can use it without worrying about losing anything.,,I am confident that I can use it without worrying about losing anything.,490615,NO,I am confident that I can use it without worrying about losing anything.,30,400700,2024-06-05T09:47:42.625432Z,2024-06-05T09:47:42.625484Z,3.939,YES,different
489974c4-bc48-11ed-a7ba-930ee103a0a2,0,5,"{""feature"":""durability of project-folders"", ""actual_sentence_extracted"":""The interior pockets are thicker than similar folders Ive tried and look like they will be more durable as a result with less creasing."", ""rephrased_it(without experience & observation)"":""The user mentioned that the interior pockets are thicker than similar folders he has tried and it looks like it will be more durable as a result with less creasing."", ""sentiment"":""positive""}",1,0,2.231802225112915,https://amazon.com/dp/B08WPZY67V,"""The interior pockets are thicker than similar folders Ive tried and look like they will be more durable as a result with less creasing.

The overall notebook is well constructed.

The materials are all good quality.

The pocket design helps keep papers secure but still easier to take in and out than standard sheet protectors.

Overall a good product that lives up the Oxford brand name.""","{'feature': 'durability of project-folders', 'actual_sentence_extracted': 'The interior pockets are thicker than similar folders Ive tried and look like they will be more durable as a result with less creasing.', 'rephrased_it(without experience & observation)': 'The user mentioned that the interior pockets are thicker than similar folders he has tried and it looks like it will be more durable as a result with less creasing.', 'sentiment': 'positive'}",durability,The user mentioned that the interior pockets are thicker than similar folders he has tried and it looks like it will be more durable as a result with less creasing.,,"The interior pockets are thicker than similar folders I've tried, making it more durable with less creasing.",490614,YES,"The interior pockets are thicker than similar folders I've tried, making it more durable with less creasing.",30,400701,2024-06-05T09:47:51.225373Z,2024-06-05T09:47:51.225439Z,6.508,YES,same
489974c4-bc48-11ed-a7ba-930ee103a0a2,0,5,"{""feature"":""closure mechanism of project-folders"", ""actual_sentence_extracted"":""The outside cover is very sturdy so I know I dont have to worry about anything getting bent."", ""rephrased_it(without experience & observation)"":""The user mentioned that the outside cover is sturdy, which provides security and prevents bending. "", ""sentiment"":""positive""}",7,0,1.787582874298096,https://amazon.com/dp/B08WPZY67V,"I got this to hold some important documents for safe keeping.

I love how the edges are really strong.

I know I can use it and not worry about losing anything.

They are clear and I am able to see everything inside., ""The outside cover is very sturdy so I know I dont have to worry about anything getting bent.

The 8 pockets open at the top, which is added security.

"", It is very professional looking, so I can use it for work or school.

Definitely worth the price and it shipped really fast.","{'feature': 'closure mechanism of project-folders', 'actual_sentence_extracted': 'The outside cover is very sturdy so I know I dont have to worry about anything getting bent.', 'rephrased_it(without experience & observation)': 'The user mentioned that the outside cover is sturdy, which provides security and prevents bending. ', 'sentiment': 'positive'}",closure mechanism,"The user mentioned that the outside cover is sturdy, which provides security and prevents bending. ",,"The outside cover is sturdy, providing security and preventing bending.",490613,Other,"The outside cover is sturdy, providing security and preventing bending.",30,400702,2024-06-05T09:47:58.757635Z,2024-06-05T09:47:58.757687Z,5.947,YES,different
489974c4-bc48-11ed-a7ba-930ee103a0a2,0,5,"{""feature"":""closure mechanism of project-folders"", ""actual_sentence_extracted"":""Covers are definitely water resistant - had a little spill that simply bubbled up on top and I rubbed off with no issues."", ""rephrased_it(without experience & observation)"":""The user mentioned that the covers are water resistant and it did not cause any issues when there was a spill."", ""sentiment"":""positive""}",5,0,2.087181091308594,https://amazon.com/dp/B08WPZY67V,"""Happy with the quality of the materials in this pocket folder.

It isnt cheap, flimsy plastic.

Great for keeping any documents, notes, even for organizing bills.

"", Covers are definitely water resistant - had a little spill that simply bubbled up on top and I rubbed off with no issues., ""For the ~$10 price range, Id recommend this.""","{'feature': 'closure mechanism of project-folders', 'actual_sentence_extracted': 'Covers are definitely water resistant - had a little spill that simply bubbled up on top and I rubbed off with no issues.', 'rephrased_it(without experience & observation)': 'The user mentioned that the covers are water resistant and it did not cause any issues when there was a spill.', 'sentiment': 'positive'}",closure mechanism,The user mentioned that the covers are water resistant and it did not cause any issues when there was a spill.,,The covers are water resistant and did not cause any issues during a spill.,490612,Other,The covers are water resistant and did not cause any issues during a spill.,30,400703,2024-06-05T09:48:08.033515Z,2024-06-05T09:48:08.033565Z,6.222,YES,different
489974c4-bc48-11ed-a7ba-930ee103a0a2,3,3,"{""feature"":""closure mechanism of project-folders"", ""actual_sentence_extracted"": ""The binding will slip and the sheet protectors will fall out of line. So all of a sudden, the pages wont turn smoothly"", ""rephrased_it(without experience & observation)"":""The user has complained that the binding of the sheet protector will slip and the sheet protectors will fall out of line, making it difficult to turn the pages smoothly."", ""sentiment"":""negative""}",2,0,2.410123586654663,https://amazon.com/dp/B08WPZY67V,"""I started using this sheet protector for work - Im a public speaker and change out certain documents during every engagement. After about two months of travel, keeping it secure in a backpack, the binding came loose in a couple of rings. I was a little annoyed, but at $10, I managed to deal with it. Eventually, it became unusable after three months and I was forced to order another one. Again, wasnt a big deal - was hoping to get a year out of it but, $3.33/month of usage wasnt bad in my mind. But when I ordered a second one and started having the same problems, I stopped using this product. The binding will slip and the sheet protectors will fall out of line. So all of a sudden, the pages wont turn smoothly. Rather disappointed that I spent about $20 and got four months of total usage out of TWO.""","{'feature': 'closure mechanism of project-folders', 'actual_sentence_extracted': 'The binding will slip and the sheet protectors will fall out of line. So all of a sudden, the pages wont turn smoothly', 'rephrased_it(without experience & observation)': 'The user has complained that the binding of the sheet protector will slip and the sheet protectors will fall out of line, making it difficult to turn the pages smoothly.', 'sentiment': 'negative'}",closure mechanism,"The user has complained that the binding of the sheet protector will slip and the sheet protectors will fall out of line, making it difficult to turn the pages smoothly.",,"I have complained that the sheet protector binding slips and the protectors fall out of line, making it difficult to turn pages smoothly.",490611,Other,"I have complained that the sheet protector binding slips and the protectors fall out of line, making it difficult to turn pages smoothly.",30,400704,2024-06-05T09:48:19.943010Z,2024-06-05T09:48:19.943061Z,8.927,YES,different
313865b6-bc15-11ed-a7ba-930ee103a0a2,0,3,"{""feature"":""organization of project-folders"", ""actual_sentence_extracted"":""I ordered 2 more sets of the same PASTEL colored folders, exactly as pictured in this ad, but when my order arrived, the folders were a dark orange, purple, blue, etc. PRIMARY colors, definitely not PASTEL, and so unattractive"", ""rephrased_it(without experience & observation)"":""The user has complained that the folders he ordered were not as shown in the ad and were not pastel colored as expected."", ""sentiment"":""negative""}",3,0,2.825957775115967,https://amazon.com/dp/B07NP1NJWR,"Last year I ordered the black, metal mesh wall organizer (8-pocket), which has been fantastic at work! It came with 18 beautiful, durable, PASTEL colored folders in 5 different colors. Great! So far., I  then ordered 2 more sets of the same PASTEL colored folders, exactly as pictured in this ad, but when my order arrived, the folders were a dark orange, purple, blue, etc. PRIMARY colors, definitely not PASTEL, and so unattractive. I wanted matching colors--so disappointing. I returned that order, and contacted the seller, who informed me the shipping would be prohibitive if I ordered directly from the company, and not Amazon., I find it disingenuous that Amazon would still allow this product to be offered without showing the actual colors that are being shipped.","{'feature': 'organization of project-folders', 'actual_sentence_extracted': 'I ordered 2 more sets of the same PASTEL colored folders, exactly as pictured in this ad, but when my order arrived, the folders were a dark orange, purple, blue, etc. PRIMARY colors, definitely not PASTEL, and so unattractive', 'rephrased_it(without experience & observation)': 'The user has complained that the folders he ordered were not as shown in the ad and were not pastel colored as expected.', 'sentiment': 'negative'}",organization,The user has complained that the folders he ordered were not as shown in the ad and were not pastel colored as expected.,,I ordered folders that were not as shown in the ad and not pastel colored as expected.,490610,NO,I ordered folders that were not as shown in the ad and not pastel colored as expected.,30,400714,2024-06-05T09:49:42.977780Z,2024-06-05T09:49:42.977830Z,3.629,OTHER,different
313865b6-bc15-11ed-a7ba-930ee103a0a2,0,3,"""{'feature': 'durability of project-folders', 'actual_sentence_extracted': 'It came with 18 beautiful, durable, PASTEL colored folders in 5 different colors. Great! So far', 'rephrased_it(without experience & observation)': 'The user mentioned that the folders that came with the product were beautiful, durable and PASTEL colored. He is satisfied with the durability of the folders.', 'sentiment': 'positive'}""",3,0,2.425415277481079,https://amazon.com/dp/B07NP1NJWR,"Last year I ordered the black, metal mesh wall organizer (8-pocket), which has been fantastic at work! It came with 18 beautiful, durable, PASTEL colored folders in 5 different colors. Great! So far., I  then ordered 2 more sets of the same PASTEL colored folders, exactly as pictured in this ad, but when my order arrived, the folders were a dark orange, purple, blue, etc. PRIMARY colors, definitely not PASTEL, and so unattractive. I wanted matching colors--so disappointing. I returned that order, and contacted the seller, who informed me the shipping would be prohibitive if I ordered directly from the company, and not Amazon., I find it disingenuous that Amazon would still allow this product to be offered without showing the actual colors that are being shipped.","{'feature': 'durability of project-folders', 'actual_sentence_extracted': 'It came with 18 beautiful, durable, PASTEL colored folders in 5 different colors. Great! So far', 'rephrased_it(without experience & observation)': 'The user mentioned that the folders that came with the product were beautiful, durable and PASTEL colored. He is satisfied with the durability of the folders.', 'sentiment': 'positive'}",durability,"The user mentioned that the folders that came with the product were beautiful, durable and PASTEL colored. He is satisfied with the durability of the folders.",,"The folders that came with the product are beautiful, durable and pastel colored. I am satisfied with their durability.",490609,NO,"The folders that came with the product are beautiful, durable and pastel colored. I am satisfied with their durability.",30,400713,2024-06-05T09:49:37.809927Z,2024-06-05T09:49:37.809979Z,4.522,YES,different
313865b6-bc15-11ed-a7ba-930ee103a0a2,13,4,"""{'feature': 'durability of project-folders', 'actual_sentence_extracted': 'they work well I just was hoping for something a little more sturdy when sitting vertical in a step up file holder,  these work but tend to druop after a bit', 'rephrased_it(without experience & observation)': 'The user mentioned that the folders are nice, but he was hoping for something a little more sturdy when sitting vertical in a step up file holder, and they tend to droop after a bit.', 'sentiment': 'negative'}""",1,0,2.826837062835693,https://amazon.com/dp/B07NP1NJWR,"Purchased to upgrade my frequently used file folders at my desk at work to something more durable.  These are nice,  like the colors.  they work well I just was hoping for something a little more sturdy when sitting vertical in a step up file holder,  these work but tend to druop after a bit.  Note that not both sides are open one is sealed shut which is not a huge big deal, but if you have thick files to place it may make it a bit difficult to hold everything.  The are also translucent in color so you can see anything you have in them so if your looking for folders that you want to put confidential info and keep on a desk or something these would not be a good fit, you would have to put another paper in to cover up what you dont want visiable.  The other downfall is the tab is really small compared to regular file folders so if you like to print your labels to put on them you have to have a smaller label the regular sized file folder labels are too big. but the labels stick nice and dont appear to be falling off so thats a plus. I think they are nice & I like them just some small issue I had to work around in order to use as I had envisioned.","{'feature': 'durability of project-folders', 'actual_sentence_extracted': 'they work well I just was hoping for something a little more sturdy when sitting vertical in a step up file holder,  these work but tend to druop after a bit', 'rephrased_it(without experience & observation)': 'The user mentioned that the folders are nice, but he was hoping for something a little more sturdy when sitting vertical in a step up file holder, and they tend to droop after a bit.', 'sentiment': 'negative'}",durability,"The user mentioned that the folders are nice, but he was hoping for something a little more sturdy when sitting vertical in a step up file holder, and they tend to droop after a bit.",,"The folders are nice, but I was hoping for something more sturdy when sitting vertical in a step up file holder as they tend to droop after a bit.",490608,YES,"The folders are nice, but I was hoping for something more sturdy when sitting vertical in a step up file holder as they tend to droop after a bit.",30,400712,2024-06-05T09:49:31.866753Z,2024-06-05T09:49:31.866817Z,4.078,NO,different
313865b6-bc15-11ed-a7ba-930ee103a0a2,0,3,"""{'feature': 'closure mechanism of project-folders', 'actual_sentence_extracted': 'It came with 18 beautiful, durable, PASTEL colored folders in 5 different colors', 'rephrased_it(without experience & observation)': 'The user mentioned that the product came with 18 beautiful, durable, PASTEL colored folders in 5 different colors.', 'sentiment': 'positive'}""",3,0,2.183768749237061,https://amazon.com/dp/B07NP1NJWR,"Last year I ordered the black, metal mesh wall organizer (8-pocket), which has been fantastic at work! It came with 18 beautiful, durable, PASTEL colored folders in 5 different colors. Great! So far., I  then ordered 2 more sets of the same PASTEL colored folders, exactly as pictured in this ad, but when my order arrived, the folders were a dark orange, purple, blue, etc. PRIMARY colors, definitely not PASTEL, and so unattractive. I wanted matching colors--so disappointing. I returned that order, and contacted the seller, who informed me the shipping would be prohibitive if I ordered directly from the company, and not Amazon., I find it disingenuous that Amazon would still allow this product to be offered without showing the actual colors that are being shipped.","{'feature': 'closure mechanism of project-folders', 'actual_sentence_extracted': 'It came with 18 beautiful, durable, PASTEL colored folders in 5 different colors', 'rephrased_it(without experience & observation)': 'The user mentioned that the product came with 18 beautiful, durable, PASTEL colored folders in 5 different colors.', 'sentiment': 'positive'}",closure mechanism,"The user mentioned that the product came with 18 beautiful, durable, PASTEL colored folders in 5 different colors.",,"I received 18 beautiful, durable, PASTEL colored folders in 5 different colors with the product.",490607,NO,"I received 18 beautiful, durable, PASTEL colored folders in 5 different colors with the product.",30,400711,2024-06-05T09:49:25.732148Z,2024-06-05T09:49:25.732205Z,5.078,OTHER,different
313865b6-bc15-11ed-a7ba-930ee103a0a2,13,4,"""{'feature': 'closure mechanism of project-folders', 'actual_sentence_extracted': 'Note that not both sides are open one is sealed shut which is not a huge big deal, but if you have thick files to place it may make it a bit difficult to hold everything', 'rephrased_it(without experience & observation)': 'The user mentioned that not both sides are open, one is sealed shut which may make it difficult to hold thick files.', 'sentiment': 'negative'}""",1,0,2.543822526931763,https://amazon.com/dp/B07NP1NJWR,"Purchased to upgrade my frequently used file folders at my desk at work to something more durable.  These are nice,  like the colors.  they work well I just was hoping for something a little more sturdy when sitting vertical in a step up file holder,  these work but tend to druop after a bit.  Note that not both sides are open one is sealed shut which is not a huge big deal, but if you have thick files to place it may make it a bit difficult to hold everything.  The are also translucent in color so you can see anything you have in them so if your looking for folders that you want to put confidential info and keep on a desk or something these would not be a good fit, you would have to put another paper in to cover up what you dont want visiable.  The other downfall is the tab is really small compared to regular file folders so if you like to print your labels to put on them you have to have a smaller label the regular sized file folder labels are too big. but the labels stick nice and dont appear to be falling off so thats a plus. I think they are nice & I like them just some small issue I had to work around in order to use as I had envisioned.","{'feature': 'closure mechanism of project-folders', 'actual_sentence_extracted': 'Note that not both sides are open one is sealed shut which is not a huge big deal, but if you have thick files to place it may make it a bit difficult to hold everything', 'rephrased_it(without experience & observation)': 'The user mentioned that not both sides are open, one is sealed shut which may make it difficult to hold thick files.', 'sentiment': 'negative'}",closure mechanism,"The user mentioned that not both sides are open, one is sealed shut which may make it difficult to hold thick files.",,"One side of the folder is sealed shut, which may make it difficult to hold thick files.",490606,YES,"One side of the folder is sealed shut, which may make it difficult to hold thick files.",30,400710,2024-06-05T09:49:19.124984Z,2024-06-05T09:49:19.125037Z,6.09,YES,same
